[
  {
    "id": "player_001",
    "label": "Michael Jordan",
    "x": 100.5,
    "y": 200.3,
    "size": 25,
    "color": "#1E90FF",
    "position": "SG",
    "era": "1990s",
    "is_active": false,
    "hof": true,
    "draft_year": 1984,
    "degree": 45,
    "betweenness": 0.0823,
    "community": 1
  },
  {
    "id": "player_002",
    "label": "Scottie Pippen",
    "x": 120.8,
    "y": 210.1,
    "size": 20,
    "color": "#1E90FF",
    "position": "SF",
    "era": "1990s",
    "is_active": false,
    "hof": true,
    "draft_year": 1987,
    "degree": 38,
    "betweenness": 0.0541,
    "community": 1
  },
  {
    "id": "player_003",
    "label": "LeBron James",
    "x": 300.5,
    "y": 150.7,
    "size": 30,
    "color": "#FF6B6B",
    "position": "SF",
    "era": "2010s",
    "is_active": true,
    "hof": false,
    "draft_year": 2003,
    "degree": 112,
    "betweenness": 0.1234,
    "community": 2
  },
  {
    "id": "player_004",
    "label": "Kobe Bryant",
    "x": 180.3,
    "y": 175.2,
    "size": 28,
    "color": "#FFD93D",
    "position": "SG",
    "era": "2000s",
    "is_active": false,
    "hof": true,
    "draft_year": 1996,
    "degree": 89,
    "betweenness": 0.0912,
    "community": 3
  },
  {
    "id": "player_005",
    "label": "Stephen Curry",
    "x": 350.1,
    "y": 160.4,
    "size": 22,
    "color": "#FF6B6B",
    "position": "PG",
    "era": "2010s",
    "is_active": true,
    "hof": false,
    "draft_year": 2009,
    "degree": 75,
    "betweenness": 0.0723,
    "community": 2
  }
]
